[
  {
    "id": "debt_ratio",
    "termRef": "tm_9e1rb64c",
    "category": "financial_structure",
    "framework": "input",
    "versions": {
      "excel": {
        "numerator": "line.bs_total_liabilities",
        "denominator": "line.bs_total_assets",
        "unit": "percent",
        "displayDecimals": 2,
        "excel": {
          "cell": "D10",
          "formula": "SUM(財務報表!N11:N17)/財務報表!L29",
          "format": "0.0%",
          "iferror": "N/A"
        },
        "naWhen": ["denominator_zero"],
        "notMeaningfulWhen": [],
        "flags": ["end_of_period_balance"]
      },
      "slides03": {
        "numerator": "line.bs_total_liabilities",
        "denominator": "line.bs_total_assets",
        "unit": "percent",
        "displayDecimals": 2,
        "naWhen": ["denominator_zero"],
        "notMeaningfulWhen": [],
        "flags": ["end_of_period_balance"]
      }
    },
    "pendingRefs": ["T24", "T38"]
  },
  {
    "id": "long_term_funds_to_ppe",
    "termRef": "tm_8eyx0srs",
    "category": "financial_structure",
    "framework": "input",
    "versions": {
      "excel": {
        "numerator": "line.bs_noncurrent_liabilities + line.bs_total_equity",
        "denominator": "line.bs_machinery_net",
        "unit": "percent",
        "displayDecimals": 2,
        "excel": {
          "cell": "D11",
          "formula": "(SUM(財務報表!N16:N17)+SUM(財務報表!N19:N28))/財務報表!L19",
          "format": "0.0%",
          "iferror": "N/A"
        },
        "naWhen": ["denominator_zero"],
        "notMeaningfulWhen": [],
        "flags": ["end_of_period_balance", "excel_approximation"]
      },
      "slides03": {
        "numerator": "line.bs_noncurrent_liabilities + line.bs_total_equity",
        "denominator": "line.bs_machinery_net + line.bs_office_equipment",
        "unit": "percent",
        "displayDecimals": 2,
        "naWhen": ["denominator_zero"],
        "notMeaningfulWhen": [],
        "flags": ["end_of_period_balance"]
      }
    },
    "pendingRefs": ["T24"]
  },
  {
    "id": "cash_flow_adequacy",
    "termRef": "tm_35qb8and",
    "category": "cash_flow",
    "framework": "input",
    "versions": {
      "excel": {
        "numerator": "line.cf_operating_total",
        "denominator": "-line.cf_capex + max(-line.cf_inventory_increase, 0) - line.cf_dividends_paid",
        "unit": "percent",
        "displayDecimals": 2,
        "excel": {
          "cell": "D15",
          "formula": "財務報表!H23/(-財務報表!H26-財務報表!H16-財務報表!H35)",
          "format": "0.0%",
          "iferror": "N/A"
        },
        "naWhen": ["denominator_zero"],
        "notMeaningfulWhen": ["denominator_negative"],
        "flags": ["single_period_approx", "website_fix"]
      },
      "slides03": {
        "numerator": "line.cf_operating_total",
        "denominator": "-line.cf_capex + max(-line.cf_inventory_increase, 0) - line.cf_dividends_paid",
        "unit": "percent",
        "displayDecimals": 2,
        "naWhen": ["denominator_zero"],
        "notMeaningfulWhen": ["denominator_negative"],
        "flags": ["single_period_approx"]
      }
    },
    "pendingRefs": ["T24"]
  },
  {
    "id": "cash_flow_ratio",
    "termRef": "tm_555a7d2s",
    "category": "cash_flow",
    "framework": "input",
    "versions": {
      "excel": {
        "numerator": "line.cf_operating_total",
        "denominator": "line.bs_current_liabilities",
        "unit": "percent",
        "displayDecimals": 2,
        "excel": {
          "cell": "D16",
          "formula": "財務報表!H23/SUM(財務報表!N11:N15)",
          "format": "0.0%",
          "iferror": "N/A"
        },
        "naWhen": ["denominator_zero"],
        "notMeaningfulWhen": [],
        "flags": ["end_of_period_balance"]
      },
      "slides03": {
        "numerator": "line.cf_operating_total",
        "denominator": "line.bs_current_liabilities",
        "unit": "percent",
        "displayDecimals": 2,
        "naWhen": ["denominator_zero"],
        "notMeaningfulWhen": [],
        "flags": ["end_of_period_balance"]
      }
    },
    "pendingRefs": []
  },
  {
    "id": "cash_reinvestment",
    "termRef": "tm_jbtbky5v",
    "category": "cash_flow",
    "framework": "input",
    "versions": {
      "excel": {
        "numerator": "line.cf_operating_total + line.cf_dividends_paid",
        "denominator": "line.bs_total_assets - line.bs_current_liabilities",
        "unit": "percent",
        "displayDecimals": 2,
        "excel": {
          "cell": "D17",
          "formula": "(財務報表!H23-財務報表!H35)/(SUM(財務報表!L18:L21)+SUM(財務報表!L23:L25)+SUM(財務報表!L12:L15)-SUM(財務報表!N11:N15))",
          "format": "0.0%",
          "iferror": "N/A"
        },
        "naWhen": ["denominator_zero"],
        "notMeaningfulWhen": ["denominator_negative"],
        "flags": ["end_of_period_balance", "website_fix"]
      },
      "slides03": {
        "numerator": "line.cf_operating_total + line.cf_dividends_paid",
        "denominator": "line.bs_ppe_gross + line.bs_investments_other + line.bs_intangible_assets + line.bs_deferred_org_costs + line.bs_deferred_dev_costs + line.bs_current_assets - line.bs_current_liabilities",
        "unit": "percent",
        "displayDecimals": 2,
        "naWhen": ["denominator_zero"],
        "notMeaningfulWhen": ["denominator_negative"],
        "flags": ["end_of_period_balance", "website_definition"]
      }
    },
    "pendingRefs": ["T24", "T25"]
  },
  {
    "id": "ar_turnover",
    "termRef": "tm_2s4hterv",
    "category": "activity",
    "framework": "transform",
    "versions": {
      "excel": {
        "numerator": "line.is_revenue",
        "denominator": "line.bs_accounts_receivable",
        "unit": "turnover",
        "displayDecimals": 2,
        "excel": {
          "cell": "H11",
          "formula": "財務報表!R10/財務報表!L13",
          "format": "0.00",
          "iferror": "N/A"
        },
        "naWhen": ["denominator_zero"],
        "notMeaningfulWhen": [],
        "flags": ["end_of_period_balance"]
      },
      "slides03": {
        "numerator": "line.is_revenue",
        "denominator": "avg(line.bs_accounts_receivable)",
        "unit": "turnover",
        "displayDecimals": 2,
        "naWhen": ["denominator_zero"],
        "notMeaningfulWhen": [],
        "flags": []
      }
    },
    "pendingRefs": []
  },
  {
    "id": "days_sales_outstanding",
    "termRef": "tm_gysqtps0",
    "category": "activity",
    "framework": "transform",
    "versions": {
      "excel": {
        "expr": "365 / ratio.ar_turnover.excel",
        "unit": "days",
        "displayDecimals": 2,
        "excel": {
          "cell": "H12",
          "formula": "365/H11",
          "format": "0.00",
          "iferror": "N/A"
        },
        "naWhen": ["chained_source_na_or_zero"],
        "notMeaningfulWhen": [],
        "flags": ["end_of_period_balance"]
      },
      "slides03": {
        "expr": "365 / ratio.ar_turnover.slides03",
        "unit": "days",
        "displayDecimals": 2,
        "naWhen": ["chained_source_na_or_zero"],
        "notMeaningfulWhen": [],
        "flags": []
      }
    },
    "pendingRefs": []
  },
  {
    "id": "ap_turnover",
    "termRef": "tm_2jyfy0hn",
    "category": "activity",
    "framework": "transform",
    "versions": {
      "excel": {
        "numerator": "line.is_purchases",
        "denominator": "line.bs_accounts_payable",
        "unit": "turnover",
        "displayDecimals": 2,
        "excel": {
          "cell": "H14",
          "formula": "財務報表!R13/財務報表!N12",
          "format": "0.00",
          "iferror": "N/A(應付帳款為0)"
        },
        "naWhen": ["denominator_zero"],
        "notMeaningfulWhen": [],
        "flags": ["end_of_period_balance", "excel_approximation"]
      },
      "slides03": {
        "numerator": "line.is_cogs",
        "denominator": "avg(line.bs_accounts_payable)",
        "unit": "turnover",
        "displayDecimals": 2,
        "naWhen": ["denominator_zero"],
        "notMeaningfulWhen": [],
        "flags": []
      }
    },
    "pendingRefs": ["T27"]
  },
  {
    "id": "inventory_turnover",
    "termRef": "tm_08g66t9j",
    "category": "activity",
    "framework": "transform",
    "versions": {
      "excel": {
        "numerator": "line.is_cogs",
        "denominator": "line.bs_inventory",
        "unit": "turnover",
        "displayDecimals": 2,
        "excel": {
          "cell": "H16",
          "formula": "財務報表!R15/財務報表!L14",
          "format": "0.00",
          "iferror": "N/A"
        },
        "naWhen": ["denominator_zero"],
        "notMeaningfulWhen": [],
        "flags": ["end_of_period_balance"]
      },
      "slides03": {
        "numerator": "line.is_cogs",
        "denominator": "avg(line.bs_inventory)",
        "unit": "turnover",
        "displayDecimals": 2,
        "naWhen": ["denominator_zero"],
        "notMeaningfulWhen": [],
        "flags": []
      }
    },
    "pendingRefs": ["T06"]
  },
  {
    "id": "days_inventory",
    "termRef": "tm_fsv83x2z",
    "category": "activity",
    "framework": "transform",
    "versions": {
      "excel": {
        "expr": "365 / ratio.inventory_turnover.excel",
        "unit": "days",
        "displayDecimals": 2,
        "excel": {
          "cell": "H17",
          "formula": "365/H16",
          "format": "0.00",
          "iferror": "N/A"
        },
        "naWhen": ["chained_source_na_or_zero"],
        "notMeaningfulWhen": [],
        "flags": ["end_of_period_balance"]
      },
      "slides03": {
        "expr": "365 / ratio.inventory_turnover.slides03",
        "unit": "days",
        "displayDecimals": 2,
        "naWhen": ["chained_source_na_or_zero"],
        "notMeaningfulWhen": [],
        "flags": []
      }
    },
    "pendingRefs": []
  },
  {
    "id": "ppe_turnover",
    "termRef": "tm_4tz4q9pa",
    "category": "activity",
    "framework": "transform",
    "versions": {
      "excel": {
        "numerator": "line.is_revenue",
        "denominator": "line.bs_machinery_net",
        "unit": "turnover",